{
  "name": "SampleAgentA",
  "version": "1.0",
  "enabled": true,
  "mcp_compliant": true,
  "mcp_exposed_methods": ["perform_dns_lookup"],
  "parameter_ranges": {
    "min_values": {},
    "max_values": {},
    "default_values": {}
  },
  "approval_thresholds": {
    "change_threshold": 0.1,
    "critical_parameters": []
  },
  "mcp_schema": {
    "description": "DNS lookup agent for the adaptive control system"
  },
  "orchestration_metadata": {
    "domain_knowledge": "DNS lookups",
    "safety_constraints": [],
    "learning_preferences": {}
  },
  "settings": {
    "timeout": 30,
    "retries": 3
  }
}